{
  "DeltaE_LCT_J": 480.0,
  "E_LCT_J": 10080.0,
  "J_T_bit_s": 186154.63115190621,
  "K_time_series": [
    {
      "K_active_admissible": 1,
      "K_draining": 0,
      "acquiring_terminal_count": 0,
      "retargeting_terminal_count": 0,
      "setup_connection_count": 0,
      "setup_reserved_terminal_count": 0,
      "setup_terminal_count": 0,
      "t_s": 0.0
    },
    {
      "K_active_admissible": 1,
      "K_draining": 0,
      "acquiring_terminal_count": 0,
      "retargeting_terminal_count": 0,
      "setup_connection_count": 0,
      "setup_reserved_terminal_count": 0,
      "setup_terminal_count": 0,
      "t_s": 6.0
    }
  ],
  "N_T_bits": 31217.767146556987,
  "R_del_T": 0.9913283980148454,
  "T_s": 30.0,
  "all_offered_business_delivered": false,
  "bindings": {
    "baseline_seal": {
      "byte_count": 656,
      "path": "research_versions/dynamic_k_v1/baselines/legacy_baseline_20261010T030541_607456Z/seal.json",
      "sha256": "2c4d329a9fa2839ab181115e97a75a3dabfb6472961b69909f6b789ec04a6f4f"
    },
    "candidate_revision_id": "0004",
    "implementation_manifest": {
      "byte_count": 19043,
      "path": "research_versions/dynamic_k_v1/acceptance/0004/implementation_manifest.json",
      "sha256": "227043a6bcf318846bbc2e854130613b49082ef6a7e17f3913160f24f40456ad"
    },
    "parent_revision": {
      "byte_count": 5889,
      "path": "research_versions/dynamic_k_v1/revisions/0003/record.json",
      "sha256": "7c9fa913a72ab740dfff233513c766ded57326fad2906c259d8ba56a3998baeb"
    },
    "scope": "ENGINEERING_TEST_ONLY",
    "version_origin": {
      "byte_count": 1555,
      "path": "research_versions/dynamic_k_v1/version_record.json",
      "sha256": "ce3fe1dfd2291714508c5a0f907b83711675a01079bca8a7229d99cb75fce691"
    }
  },
  "delivered_bit_age_integral_bit_s": null,
  "delivered_bits": 3568782.2328534434,
  "delivered_fluid_age_implemented": false,
  "dynamic_terminal_count": 320,
  "evaluation_completed_normally": false,
  "five_execution_state_dwell_s": {
    "ACQUIRING": 0.0,
    "ACTIVE": 12.0,
    "DRAINING": 0.0,
    "IDLE": 1908.0,
    "RETARGETING": 0.0
  },
  "four_energy_state_dwell_s": {
    "ACQUIRING": 0.0,
    "ACTIVE": 12.0,
    "IDLE": 1908.0,
    "RETARGETING": 0.0
  },
  "in_flight_bits": 31217.767146556987,
  "initial_state_sha256": "ef8183d6f4b46f1096af42ff3ee13d338cdf79d69ad6c546c44356cf7c802494",
  "injection_end_s": 9.0,
  "input_trace_sha256": "ac9d9347df99cd5d0de867a5d41f2f1f55453e0a2e1ae65d240c2bde2e983f2b",
  "mean_delivered_fluid_delay_s": null,
  "offered_bits": 3600000.0,
  "per_terminal_execution_dwell_s": [
    {
      "dwell_s": {
        "ACQUIRING": 0.0,
        "ACTIVE": 0.0,
        "DRAINING": 0.0,
        "IDLE": 6.0,
        "RETARGETING": 0.0
      },
      "terminal_id": [
        "X0_1",
        "D1"
      ]
    },
    {
      "dwell_s": {
        "ACQUIRING": 0.0,
        "ACTIVE": 6.0,
        "DRAINING": 0.0,
        "IDLE": 0.0,
        "RETARGETING": 0.0
      },
      "terminal_id": [
        "X0_1",
        "D2"
      ]
    },
    {
      "dwell_s": {
        "ACQUIRING": 0.0,
        "ACTIVE": 0.0,
        "DRAINING": 0.0,
        "IDLE": 6.0,
        "RETARGETING": 0.0
      },
      "terminal_id": [
        "X0_10",
        "D1"
      ]
    },
    {
      "dwell_s": {
        "ACQUIRING": 0.0,
        "ACTIVE": 0.0,
        "DRAINING": 0.0,
        "IDLE": 6.0,
        "RETARGETING": 0.0
      },
      "terminal_id": [
        "X0_10",
        "D2"
      ]
    },
    {
      "dwell_s": {
        "ACQUIRING": 0.0,
        "ACTIVE": 0.0,
        "DRAINING": 0.0,
        "IDLE": 6.0,
        "RETARGETING": 0.0
      },
      "terminal_id": [
        "X0_11",
        "D1"
      ]
    },
    {
      "dwell_s": {
        "ACQUIRING": 0.0,
        "ACTIVE": 0.0,
        "DRAINING": 0.0,
        "IDLE": 6.0,
        "RETARGETING": 0.0
      },
      "terminal_id": [
        "X0_11",
        "D2"
      ]
    },
    {
      "dwell_s": {
        "ACQUIRING": 0.0,
        "ACTIVE": 0.0,
        "DRAINING": 0.0,
        "IDLE": 6.0,
        "RETARGETING": 0.0
      },
      "terminal_id": [
        "X0_12",
        "D1"
      ]
    },
    {
      "dwell_s": {
        "ACQUIRING": 0.0,
        "ACTIVE": 0.0,
        "DRAINING": 0.0,
        "IDLE": 6.0,
        "RETARGETING": 0.0
      },
      "terminal_id": [
        "X0_12",
        "D2"
      ]
    },
    {
      "dwell_s": {
        "ACQUIRING": 0.0,
        "ACTIVE": 0.0,
        "DRAINING": 0.0,
        "IDLE": 6.0,
        "RETARGETING": 0.0
      },
      "terminal_id": [
        "X0_13",
        "D1"
      ]
    },
    {
      "dwell_s": {
        "ACQUIRING": 0.0,
        "ACTIVE": 0.0,
        "DRAINING": 0.0,
        "IDLE": 6.0,
        "RETARGETING": 0.0
      },
      "terminal_id": [
        "X0_13",
        "D2"
      ]
    },
    {
      "dwell_s": {
        "ACQUIRING": 0.0,
        "ACTIVE": 0.0,
        "DRAINING": 0.0,
        "IDLE": 6.0,
        "RETARGETING": 0.0
      },
      "terminal_id": [
        "X0_14",
        "D1"
      ]
    },
    {
      "dwell_s": {
        "ACQUIRING": 0.0,
        "ACTIVE": 0.0,
        "DRAINING": 0.0,
        "IDLE": 6.0,
        "RETARGETING": 0.0
      },
      "terminal_id": [
        "X0_14",
        "D2"
      ]
    },
    {
      "dwell_s": {
        "ACQUIRING": 0.0,
        "ACTIVE": 0.0,
        "DRAINING": 0.0,
        "IDLE": 6.0,
        "RETARGETING": 0.0
      },
      "terminal_id": [
        "X0_15",
        "D1"
      ]
    },
    {
      "dwell_s": {
        "ACQUIRING": 0.0,
        "ACTIVE": 0.0,
        "DRAINING": 0.0,
        "IDLE": 6.0,
        "RETARGETING": 0.0
      },
      "terminal_id": [
        "X0_15",
        "D2"
      ]
    },
    {
      "dwell_s": {
        "ACQUIRING": 0.0,
        "ACTIVE": 0.0,
        "DRAINING": 0.0,
        "IDLE": 6.0,
        "RETARGETING": 0.0
      },
      "terminal_id": [
        "X0_16",
        "D1"
      ]
    },
    {
      "dwell_s": {
        "ACQUIRING": 0.0,
        "ACTIVE": 0.0,
        "DRAINING": 0.0,
        "IDLE": 6.0,
        "RETARGETING": 0.0
      },
      "terminal_id": [
        "X0_16",
        "D2"
      ]
    },
    {
      "dwell_s": {
        "ACQUIRING": 0.0,
        "ACTIVE": 0.0,
        "DRAINING": 0.0,
        "IDLE": 6.0,
        "RETARGETING": 0.0
      },
      "terminal_id": [
        "X0_17",
        "D1"
      ]
    },
    {
      "dwell_s": {
        "ACQUIRING": 0.0,
        "ACTIVE": 0.0,
        "DRAINING": 0.0,
        "IDLE": 6.0,
        "RETARGETING": 0.0
      },
      "terminal_id": [
        "X0_17",
        "D2"
      ]
    },
    {
      "dwell_s": {
        "ACQUIRING": 0.0,
        "ACTIVE": 0.0,
        "DRAINING": 0.0,
        "IDLE": 6.0,
        "RETARGETING": 0.0
      },
      "terminal_id": [
        "X0_18",
        "D1"
      ]
    },
    {
      "dwell_s": {
        "ACQUIRING": 0.0,
        "ACTIVE": 0.0,
        "DRAINING": 0.0,
        "IDLE": 6.0,
        "RETARGETING": 0.0
      },
      "terminal_id": [
        "X0_18",
        "D2"
      ]
    },
    {
      "dwell_s": {
        "ACQUIRING": 0.0,
        "ACTIVE": 0.0,
        "DRAINING": 0.0,
        "IDLE": 6.0,
        "RETARGETING": 0.0
      },
      "terminal_id": [
        "X0_19",
        "D1"
      ]
    },
    {
      "dwell_s": {
        "ACQUIRING": 0.0,
        "ACTIVE": 0.0,
        "DRAINING": 0.0,
        "IDLE": 6.0,
        "RETARGETING": 0.0
      },
      "terminal_id": [
        "X0_19",
        "D2"
      ]
    },
    {
      "dwell_s": {
        "ACQUIRING": 0.0,
        "ACTIVE": 0.0,
        "DRAINING": 0.0,
        "IDLE": 6.0,
        "RETARGETING": 0.0
      },
      "terminal_id": [
        "X0_2",
        "D1"
      ]
    },
    {
      "dwell_s": {
        "ACQUIRING": 0.0,
        "ACTIVE": 0.0,
        "DRAINING": 0.0,
        "IDLE": 6.0,
        "RETARGETING": 0.0
      },
      "terminal_id": [
        "X0_2",
        "D2"
      ]
    },
    {
      "dwell_s": {
        "ACQUIRING": 0.0,
        "ACTIVE": 0.0,
        "DRAINING": 0.0,
        "IDLE": 6.0,
        "RETARGETING": 0.0
      },
      "terminal_id": [
        "X0_20",
        "D1"
      ]
    },
    {
      "dwell_s": {
        "ACQUIRING": 0.0,
        "ACTIVE": 0.0,
        "DRAINING": 0.0,
        "IDLE": 6.0,
        "RETARGETING": 0.0
      },
      "terminal_id": [
        "X0_20",
        "D2"
      ]
    },
    {
      "dwell_s": {
        "ACQUIRING": 0.0,
        "ACTIVE": 0.0,
        "DRAINING": 0.0,
        "IDLE": 6.0,
        "RETARGETING": 0.0
      },
      "terminal_id": [
        "X0_21",
        "D1"
      ]
    },
    {
      "dwell_s": {
        "ACQUIRING": 0.0,
        "ACTIVE": 0.0,
        "DRAINING": 0.0,
        "IDLE": 6.0,
        "RETARGETING": 0.0
      },
      "terminal_id": [
        "X0_21",
        "D2"
      ]
    },
    {
      "dwell_s": {
        "ACQUIRING": 0.0,
        "ACTIVE": 0.0,
        "DRAINING": 0.0,
        "IDLE": 6.0,
        "RETARGETING": 0.0
      },
      "terminal_id": [
        "X0_22",
        "D1"
      ]
    },
    {
      "dwell_s": {
        "ACQUIRING": 0.0,
        "ACTIVE": 0.0,
        "DRAINING": 0.0,
        "IDLE": 6.0,
        "RETARGETING": 0.0
      },
      "terminal_id": [
        "X0_22",
        "D2"
      ]
    },
    {
      "dwell_s": {
        "ACQUIRING": 0.0,
        "ACTIVE": 0.0,
        "DRAINING": 0.0,
        "IDLE": 6.0,
        "RETARGETING": 0.0
      },
      "terminal_id": [
        "X0_23",
        "D1"
      ]
    },
    {
      "dwell_s": {
        "ACQUIRING": 0.0,
        "ACTIVE": 0.0,
        "DRAINING": 0.0,
        "IDLE": 6.0,
        "RETARGETING": 0.0
      },
      "terminal_id": [
        "X0_23",
        "D2"
      ]
    },
    {
      "dwell_s": {
        "ACQUIRING": 0.0,
        "ACTIVE": 0.0,
        "DRAINING": 0.0,
        "IDLE": 6.0,
        "RETARGETING": 0.0
      },
      "terminal_id": [
        "X0_24",
        "D1"
      ]